{
  "schema_version": "1.0",
  "message_execution_id": "msg-exec-1",
  "subject_kind": "USER",
  "subject_id": "issuer.example/users/user|42",
  "client_id": "portal-web",
  "deployment_id": "deployment-1",
  "deployment_revision_id": "deployment-revision-1",
  "assistant_profile_version_id": "profile-version-1",
  "knowledge_binding_set_id": "binding-set-1",
  "project_execution_binding_id": "binding-1",
  "project_id": "project-1",
  "project_version": "1.0.0",
  "locale": "zh-CN",
  "access_segment": "PROJECT_AUTHORIZED",
  "access_context_hash": "aaaaaaaaaaaaaaaaaaaaaaaaaaaaaaaaaaaaaaaaaaaaaaaaaaaaaaaaaaaaaaaa",
  "knowledge_release_id": "release-1",
  "authz_epoch": 7,
  "issued_at": "2026-08-11T07:59:59Z",
  "expires_at": "2026-08-11T08:05:00Z",
  "deadline_at": "2026-08-11T08:00:02Z",
  "audit": {
    "trace_id": "trace-1",
    "request_id": "request-1"
  }
}
